{
  "schema_version": "responses_runner_v2.input_manifest.v1",
  "manifest_id": "evidence_synthesis_stage2",
  "workflow_id": "document_evidence_synthesis",
  "stage_id": "evidence_synthesis",
  "description": "Raw evidence for synthesis after source-register review.",
  "primary_job_inputs": [],
  "reviewed_handoff_inputs": [],
  "attached_repository_files": [],
  "reference_context": []
}
