{
  "schema_version": "responses_runner_v2.input_manifest.v1",
  "manifest_id": "evidence_synthesis_stage1",
  "workflow_id": "document_evidence_synthesis",
  "stage_id": "source_register",
  "description": "Decision question and raw evidence for source registration.",
  "primary_job_inputs": [],
  "reviewed_handoff_inputs": [],
  "attached_repository_files": [],
  "reference_context": []
}
